{
  "$schema": "../../schemas/style-catalog.schema.json",
  "schemaVersion": 3,
  "version": "2026-07-30.2",
  "canonicalSubject": "同一森林跑道中的乌龟与兔子，用于只比较视觉语言，不代表项目最终构图。",
  "styles": [
    {
      "id": "childrens-picture-book-paper",
      "label": "儿童绘本纸片",
      "summary": "圆润、温暖、层次清楚，适合儿童故事和轻松寓言。",
      "image": "style-catalog/childrens-picture-book-paper.png",
      "profile": {
        "schemaVersion": 2,
        "generation": {
          "promptDirectives": [
            "Use rounded hand-cut paper shapes with warm watercolor grain and soft child-friendly proportions.",
            "Keep faces, silhouettes, and foreground actions simple, readable, and emotionally clear."
          ],
          "negativeDirectives": [
            "Photorealism, hard 3D plastic surfaces, and dense adult editorial detail."
          ],
          "compositionPrinciples": [
            "Favor broad color blocks and generous breathing room around the main action.",
            "Use three clearly separated paper depths without hiding the character silhouette."
          ],
          "preferredSurfaces": ["alpha", "opaque", "layer-sheet"]
        },
        "motion": {
          "pacing": "gentle",
          "preferredIdlePresets": ["breathe", "float", "sway"],
          "transitionSet": "paper-story",
          "visualSfx": {
            "policy": "rare",
            "maxPerScene": 1,
            "allowedKinds": ["impact", "motion"],
            "durationRangeSeconds": [0.2, 0.55]
          }
        },
        "render": {
          "theme": {
            "canvas": "#6f3d2f",
            "sceneBackground": "#d89b63",
            "accent": "#d65a4a",
            "ink": "#4a3027",
            "subtitle": "#fff8e8",
            "subtitleBackground": "rgba(74, 48, 39, .78)",
            "foreground": "#9f563d",
            "fontFamily": "STKaiti, KaiTi, \"Noto Serif SC\", serif",
            "surface": {
              "texture": {
                "src": "textures/paper-grain.png",
                "opacity": 0.14,
                "blendMode": "multiply"
              },
              "subjectEdge": {
                "mode": "paper-outline",
                "color": "#fff4dc",
                "widthPx": 4
              },
              "subjectShadow": {
                "mode": "drop-shadow",
                "offsetXPx": 0,
                "offsetYPx": 8,
                "blurPx": 8,
                "color": "rgba(64, 39, 28, .24)"
              }
            }
          }
        },
        "quality": {
          "requiredAssetChecks": ["style-consistent", "style-profile-conformant"],
          "requiredCompositeChecks": ["style-profile-consistent"],
          "reviewFocus": [
            "Rounded warm paper shapes match the selected reference card.",
            "The frame remains inviting, uncluttered, and readable for children."
          ]
        }
      }
    },
    {
      "id": "hand-drawn-cutout-explainer",
      "label": "手绘剪纸 / 手绘解释",
      "summary": "手绘线条、剪纸边缘和解释性图形，适合知识讲解与活泼叙事。",
      "image": "style-catalog/hand-drawn-cutout-explainer.png",
      "profile": {
        "schemaVersion": 2,
        "generation": {
          "promptDirectives": [
            "Use visible hand-drawn ink contours, cut-paper edges, and graphic explanatory marks.",
            "Build clear modular layers that can support annotations, mechanisms, and lively local motion."
          ],
          "negativeDirectives": [
            "Polished corporate vectors, photorealism, and unstructured decorative clutter."
          ],
          "compositionPrinciples": [
            "Give the hero action a strong silhouette and reserve clean space for explanatory graphics.",
            "Mix imperfect paper geometry with disciplined visual hierarchy and explicit relationships."
          ],
          "preferredSurfaces": ["alpha", "chroma-key", "opaque", "layer-sheet"]
        },
        "motion": {
          "pacing": "playful",
          "preferredIdlePresets": ["breathe", "drift", "sway"],
          "transitionSet": "paper-story",
          "visualSfx": {
            "policy": "selective",
            "maxPerScene": 2,
            "allowedKinds": ["impact", "motion"],
            "durationRangeSeconds": [0.2, 0.6]
          }
        },
        "render": {
          "theme": {
            "canvas": "#6e1e19",
            "sceneBackground": "#8a271f",
            "accent": "#e3a43a",
            "ink": "#3f241c",
            "subtitle": "#fff8ea",
            "subtitleBackground": "rgba(58, 25, 18, .76)",
            "foreground": "#8d251e",
            "fontFamily": "STKaiti, KaiTi, \"Noto Serif SC\", serif",
            "surface": {
              "texture": {
                "src": "textures/paper-grain.png",
                "opacity": 0.14,
                "blendMode": "multiply"
              },
              "subjectEdge": {
                "mode": "paper-outline",
                "color": "#f5eedc",
                "widthPx": 3
              },
              "subjectShadow": {
                "mode": "drop-shadow",
                "offsetXPx": 0,
                "offsetYPx": 10,
                "blurPx": 7,
                "color": "rgba(20, 15, 12, .28)"
              }
            }
          }
        },
        "quality": {
          "requiredAssetChecks": ["style-consistent", "style-profile-conformant"],
          "requiredCompositeChecks": ["style-profile-consistent"],
          "reviewFocus": [
            "Hand-drawn contours and physical cut-paper edges remain visible across assets.",
            "Explanatory graphics support the story without replacing semantic action."
          ]
        }
      }
    },
    {
      "id": "archival-collage",
      "label": "复古档案拼贴",
      "summary": "旧纸、印刷网点和档案照片感，适合历史、纪实与怀旧叙事。",
      "image": "style-catalog/archival-collage.png",
      "profile": {
        "schemaVersion": 2,
        "generation": {
          "promptDirectives": [
            "Use aged paper, restrained sepia color, halftone print texture, and archival cutout framing.",
            "Treat photographs and documents as tactile evidence layers with legible hierarchy."
          ],
          "negativeDirectives": [
            "Glossy modern gradients, neon color, and playful preschool proportions."
          ],
          "compositionPrinciples": [
            "Organize evidence in measured overlapping planes with one dominant archival focal point.",
            "Preserve readable margins, captions, and document edges instead of filling every gap."
          ],
          "preferredSurfaces": ["alpha", "opaque", "layer-sheet"]
        },
        "motion": {
          "pacing": "measured",
          "preferredIdlePresets": ["drift", "still", "breathe"],
          "transitionSet": "paper-story",
          "visualSfx": {
            "policy": "rare",
            "maxPerScene": 1,
            "allowedKinds": ["impact", "motion"],
            "durationRangeSeconds": [0.25, 0.6]
          }
        },
        "render": {
          "theme": {
            "canvas": "#342d27",
            "sceneBackground": "#756552",
            "accent": "#a84d3f",
            "ink": "#26211d",
            "subtitle": "#f3e8d0",
            "subtitleBackground": "rgba(38, 33, 29, .82)",
            "foreground": "#4a4036",
            "fontFamily": "Songti SC, STSong, \"Noto Serif SC\", serif",
            "surface": {
              "texture": {
                "src": "textures/paper-grain.png",
                "opacity": 0.14,
                "blendMode": "multiply"
              },
              "subjectEdge": {
                "mode": "paper-outline",
                "color": "#d9ccb0",
                "widthPx": 2
              },
              "subjectShadow": {
                "mode": "drop-shadow",
                "offsetXPx": 2,
                "offsetYPx": 6,
                "blurPx": 4,
                "color": "rgba(24, 20, 17, .38)"
              }
            }
          }
        },
        "quality": {
          "requiredAssetChecks": ["style-consistent", "style-profile-conformant"],
          "requiredCompositeChecks": ["style-profile-consistent"],
          "reviewFocus": [
            "Paper age, print texture, and archival framing agree with the reference card.",
            "Evidence hierarchy stays sober and legible without decorative nostalgia overpowering facts."
          ]
        }
      }
    },
    {
      "id": "korean-cinematic-comic",
      "label": "韩漫影视插画",
      "summary": "精致线稿、柔和渐变与电影感光影，适合情绪叙事和现代幻想。",
      "image": "style-catalog/korean-cinematic-comic.png",
      "profile": {
        "schemaVersion": 2,
        "generation": {
          "promptDirectives": [
            "Use elegant clean line art, refined expressions, soft controlled gradients, and cinematic lighting with atmospheric depth.",
            "Keep characters polished and emotionally readable while preserving a screen-oriented illustrated finish."
          ],
          "negativeDirectives": [
            "Speech balloons, captions, readable text, sound-effect lettering, logos, panel borders, and long-scroll comic layouts.",
            "Paper cutout edges, craft fibers, paper shadows, global paper texture, photorealism, and glossy 3D rendering."
          ],
          "compositionPrinciples": [
            "Build cinematic depth through lighting, color, and overlapping planes while keeping the main action immediately readable.",
            "Reserve clean subtitle-safe space and use restrained motion accents instead of dense comic-page decoration."
          ],
          "preferredSurfaces": ["alpha", "chroma-key", "opaque", "layer-sheet", "seamless-strip-x"]
        },
        "motion": {
          "pacing": "measured",
          "preferredIdlePresets": ["breathe", "drift", "float"],
          "transitionSet": "clean-video",
          "visualSfx": {
            "policy": "rare",
            "maxPerScene": 1,
            "allowedKinds": ["impact", "motion"],